{
  "$schema": "https://json-schema.org/draft/2020-12/schema",
  "$id": "https://dboytrades.local/schemas/claim.schema.json",
  "title": "Claim",
  "description": "A single assertion attributed to a source, with mandatory verbatim evidence. A claim with no evidence is not representable in this schema.",
  "type": "object",
  "additionalProperties": false,
  "required": ["claim_id", "statement", "concept", "source_key", "evidence", "confidence", "extraction"],
  "properties": {
    "_comment": {
      "type": "string",
      "description": "Free-text annotation, ignored by all tooling. Allowed so that copied templates do not fail validation on an unexpected key."
    },
    "claim_id": {
      "type": "string",
      "pattern": "^clm_[a-f0-9]{12}$",
      "description": "Content-addressed: derived from the statement plus its evidence segment IDs, so an edited claim cannot silently keep an old ID."
    },
    "statement": {
      "type": "string",
      "minLength": 10,
      "description": "The assertion in the KB author's words. This is a paraphrase for indexing; the evidence quotes are the authority."
    },
    "concept": {
      "type": "string",
      "description": "Concept key from config/taxonomy.yaml."
    },
    "source_key": { "type": "string", "enum": ["ICT", "NBBTRADER"] },
    "evidence": {
      "type": "array",
      "minItems": 1,
      "description": "At least one grounded quote. Enforced by schema AND re-verified against the corpus by `ictkb validate`.",
      "items": {
        "type": "object",
        "additionalProperties": false,
        "required": ["segment_id", "video_id", "start_s", "quote", "url"],
        "properties": {
          "segment_id": { "type": "string" },
          "video_id": { "type": "string", "pattern": "^[A-Za-z0-9_-]{11}$" },
          "start_s": { "type": "number", "minimum": 0 },
          "quote": {
            "type": "string",
            "minLength": 15,
            "description": "MUST appear verbatim (whitespace-normalised, case-insensitive) inside the referenced segment's text. `ictkb validate` fails the build otherwise."
          },
          "url": { "type": "string" }
        }
      }
    },
    "confidence": {
      "type": "string",
      "enum": ["high", "medium", "low"],
      "description": "high = explicit and unambiguous in a manual-caption segment; medium = explicit but auto-captioned or paraphrased across segments; low = inferred."
    },
    "contradicts": {
      "type": "array",
      "items": { "type": "string" },
      "description": "Claim IDs this one conflicts with. Sources contradict themselves and each other over time; the distiller refuses to build a rule on an unresolved contradiction."
    },
    "extraction": {
      "type": "object",
      "additionalProperties": false,
      "required": ["method", "extracted_at"],
      "properties": {
        "method": {
          "type": "string",
          "enum": ["human", "llm_assisted", "llm_proposed"],
          "description": "llm_proposed claims are untrusted until a human promotes them; the distiller ignores them by default."
        },
        "extracted_at": { "type": "string", "format": "date-time" },
        "reviewer": { "type": ["string", "null"] }
      }
    }
  }
}
