{
  "_comment": "TEMPLATE, NOT DATA. Every value below is placeholder text invented to show the file format. It quotes no real person and is not part of the knowledge base: this file lives in docs/ precisely so that `ictkb validate` does not load it. Copy it into kb/claims/, replace every field with real content, and let the claim_id be recomputed - it is a hash of the statement plus the evidence anchors, so a hand-copied id will not match and validation will reject it.",
  "claim_id": "clm_40e710d28bbb",
  "statement": "EXAMPLE ONLY - replace this with a real assertion drawn from a real segment.",
  "concept": "liquidity",
  "source_key": "ICT",
  "evidence": [
    {
      "segment_id": "EXAMPLEvid1:930000",
      "video_id": "EXAMPLEvid1",
      "start_s": 930.0,
      "quote": "placeholder text standing in for the words actually spoken",
      "url": "https://www.youtube.com/watch?v=EXAMPLEvid1&t=930s"
    }
  ],
  "confidence": "medium",
  "contradicts": [],
  "extraction": {
    "method": "llm_assisted",
    "extracted_at": "2026-01-01T00:00:00+00:00",
    "reviewer": "your-name"
  }
}
